{
  "architecture_class": "dense_decoder",
  "authorized": true,
  "model_id": "Qwen3-8B",
  "promotion_required": [
    "correctness",
    "route_bound",
    "speed",
    "rollback"
  ],
  "routes": [
    {
      "candidates": [
        "lanemap_gemv"
      ],
      "quant": "Q4_K",
      "role": "attn_kv",
      "selected_route": null,
      "shape": [
        1024,
        4096
      ],
      "status": "unmeasured"
    },
    {
      "candidates": [
        "q6k_route"
      ],
      "quant": "Q6_K",
      "role": "attn_kv",
      "selected_route": null,
      "shape": [
        1024,
        4096
      ],
      "status": "unmeasured"
    },
    {
      "candidates": [
        "lanemap_gemv"
      ],
      "quant": "Q4_K",
      "role": "attn_qo",
      "selected_route": null,
      "shape": [
        4096,
        4096
      ],
      "status": "unmeasured"
    },
    {
      "candidates": [
        "lanemap_gemv"
      ],
      "quant": "Q4_K",
      "role": "ffn_down",
      "selected_route": null,
      "shape": [
        4096,
        12288
      ],
      "status": "unmeasured"
    },
    {
      "candidates": [
        "q6k_route"
      ],
      "quant": "Q6_K",
      "role": "ffn_down",
      "selected_route": null,
      "shape": [
        4096,
        12288
      ],
      "status": "unmeasured"
    },
    {
      "candidates": [
        "lanemap_gemv"
      ],
      "quant": "Q4_K",
      "role": "ffn_gate_up",
      "selected_route": null,
      "shape": [
        12288,
        4096
      ],
      "status": "unmeasured"
    },
    {
      "candidates": [
        "q6k_route"
      ],
      "quant": "Q6_K",
      "role": "lm_head",
      "selected_route": null,
      "shape": [
        151936,
        4096
      ],
      "status": "unmeasured"
    }
  ],
  "schema": "boltbeam.route_policy.v1",
  "target": {
    "backend": "Metal",
    "backend_status": "descriptor_only",
    "capabilities": {
      "fact_sources": {
        "memory_bandwidth_gbs": {
          "kind": "measurement",
          "method": "tinygrad DEV=METAL, 2 GiB clone, read and write counted as traffic, best of five",
          "observed_at": "2026-09-21",
          "scope": "MacBook Air (13-inch, M3, 2024), 10-core GPU",
          "value_gbs": 89.9,
          "vendor_spec_gbs": 100.0,
          "vendor_url": "https://support.apple.com/en-us/118551"
        },
        "peak_tflops": {
          "dtype": "fp16",
          "kind": "measurement",
          "method": "tinygrad-arkey extra/llm_research/wmma_peak_metal.py, simdgroup_multiply_accumulate plateau, fp16 in and fp32 accumulate",
          "note": "matrix unit; Apple publishes no FLOPS figure for M-series",
          "observed_at": "2026-09-22",
          "scope": "MacBook Air (13-inch, M3, 2024), 10-core GPU",
          "value_tflops": 3.152
        }
      },
      "fact_status": {
        "compute_units": "unknown",
        "gpu_cores": "hardware_scan",
        "lds_bytes_per_cu": "unknown",
        "memory_bandwidth_gbs": "measurement",
        "peak_tflops": "measurement",
        "subgroup_size": "hardware_family",
        "vram_bytes": "not_applicable_unified_memory",
        "wave_size": "hardware_family"
      },
      "kv_quant_quality_gate_required": true,
      "kv_quant_speed_residual_required": true,
      "match": {
        "apple_soc": "M3",
        "gpu_cores": 10
      },
      "mixed_quant_kv_flash_fastpath": false,
      "same_type_quant_kv_flash_fastpath": false,
      "target_kind": "exact",
      "tinygrad_device": "METAL"
    },
    "compute_units": null,
    "dequant_primitives": [],
    "dot_primitives": [
      "simdgroup_matrix"
    ],
    "dot_primitives_lowered": [],
    "lds_bytes_per_cu": null,
    "matrix_tflops": {},
    "memory_bandwidth_gbs": 89.9,
    "peak_tflops": {
      "fp16": 3.152
    },
    "subgroup_size": 32,
    "target_id": "apple_m3_10c",
    "vector_load_bits": 128,
    "vram_bytes": null,
    "wave_size": 32
  }
}
